{
  "$schema": "https://json-schema.org/draft/2020-12/schema",
  "$id": "https://aegis.local/schema/payload.v2.schema.json",
  "title": "PayloadV2",
  "description": "Sanitized payload sent from the extension to the Aegis server. This object is the ONLY thing that crosses the network boundary. It may contain tokens ([[PII:TYPE:xxxxxxxx]]) and redacted pixels, never raw PII.",
  "type": "object",
  "additionalProperties": false,
  "required": [
    "session",
    "capture_id",
    "schema",
    "mode",
    "task",
    "page",
    "elements",
    "redactions",
    "state_token"
  ],
  "properties": {
    "session": {
      "type": "string",
      "minLength": 1,
      "description": "Opaque per-session id. Not derived from user identity."
    },
    "capture_id": {
      "type": "string",
      "minLength": 1,
      "description": "Identifies one observation of one screen state."
    },
    "schema": {
      "const": "aegis/2",
      "description": "Contract version marker."
    },
    "mode": {
      "$ref": "#/$defs/mode"
    },
    "task": {
      "type": "string",
      "description": "The user's task, already tokenized. May contain tokens."
    },
    "page": {
      "type": "object",
      "additionalProperties": false,
      "required": [
        "url",
        "title"
      ],
      "properties": {
        "url": {
          "type": "string",
          "description": "Sanitized URL. Query/fragment PII is tokenized or stripped."
        },
        "title": {
          "type": "string",
          "description": "Sanitized document title."
        },
        "type": {
          "type": "string",
          "description": "Coarse page classification, e.g. kyc_form, checkout, login."
        }
      }
    },
    "elements": {
      "type": "array",
      "description": "Set-of-Marks elements. Labels are sanitized; raw values are never included.",
      "items": {
        "$ref": "#/$defs/element"
      }
    },
    "visual_regions": {
      "type": "array",
      "description": "Regions produced by the local vision detector.",
      "items": {
        "$ref": "#/$defs/visualRegion"
      }
    },
    "redactions": {
      "type": "array",
      "description": "Every redaction applied to the image, declared so the server can reason about what it cannot see.",
      "items": {
        "$ref": "#/$defs/redaction"
      }
    },
    "image": {
      "$ref": "#/$defs/dataUrlImage",
      "description": "Redacted screenshot as a data URL. Omitted in image-only-off or text-delta routing."
    },
    "texts": {
      "type": "array",
      "description": "Sanitized visible text blocks, capped by TEXT_BUDGET_CHARS (see extension/shared/config.ts).",
      "items": {
        "$ref": "#/$defs/textBlock"
      }
    },
    "state_token": {
      "type": "string",
      "pattern": "^S[a-z2-7]{10}$"
    },
    "field_hints": {
      "type": "array",
      "items": {
        "type": "object",
        "additionalProperties": false,
        "required": [
          "eid",
          "category",
          "fill"
        ],
        "properties": {
          "eid": {
            "type": "string",
            "pattern": "^E[0-9]{1,6}$"
          },
          "category": {
            "type": "string",
            "minLength": 1
          },
          "fill": {
            "const": "empty"
          }
        }
      }
    },
    "history": {
      "type": "array",
      "maxItems": 25,
      "items": {
        "$ref": "#/$defs/historyEntry"
      }
    },
    "context_denied": {
      "enum": [
        "BUDGET_EXHAUSTED",
        "NO_SAFE_ELEMENTS",
        "INVALID_REQUEST"
      ]
    }
  },
  "$defs": {
    "mode": {
      "type": "string",
      "enum": [
        "fast",
        "balanced",
        "accurate"
      ],
      "description": "Routing mode. Trades latency against perception depth."
    },
    "bbox": {
      "type": "array",
      "description": "Axis-aligned box [x, y, w, h] in CSS pixels relative to the viewport.",
      "items": {
        "type": "integer"
      },
      "minItems": 4,
      "maxItems": 4
    },
    "valueLenBucket": {
      "type": "string",
      "enum": [
        "empty",
        "short",
        "medium",
        "long"
      ],
      "description": "Coarse length bucket. Never the value, never the exact length."
    },
    "element": {
      "type": "object",
      "additionalProperties": false,
      "required": [
        "eid",
        "fp",
        "role",
        "label",
        "bbox",
        "visible",
        "enabled"
      ],
      "properties": {
        "fp": {
          "type": "string",
          "minLength": 1,
          "description": "Stable element fingerprint used to reacquire the element before acting. Not a selector and not derived from page id/class names."
        },
        "role": {
          "type": "string",
          "description": "Accessibility role, e.g. textbox, button, combobox."
        },
        "label": {
          "type": "string",
          "description": "Sanitized accessible name. May contain tokens."
        },
        "input_type": {
          "type": "string",
          "description": "Input type, e.g. text, email, password. Drives token type matching on re-hydration."
        },
        "has_value": {
          "type": "boolean",
          "description": "Whether the field currently holds a value. The value itself is never sent."
        },
        "value_len_bucket": {
          "$ref": "#/$defs/valueLenBucket"
        },
        "bbox": {
          "$ref": "#/$defs/bbox"
        },
        "visible": {
          "type": "boolean"
        },
        "enabled": {
          "type": "boolean"
        },
        "hidden_interactive": {
          "type": "boolean",
          "description": "Interactive in the DOM but not visible to the user. Flagged as a possible injection/clickjacking vector."
        },
        "value_token": {
          "$ref": "#/$defs/piiToken",
          "description": "Token standing in for this field's value (Stage 2). Present only when policy decided TOKEN/TOKEN_WITH_APPROVAL for it; the raw value is never sent."
        },
        "eid": {
          "type": "string",
          "pattern": "^E[0-9]{1,6}$"
        },
        "occluded": {
          "type": "boolean",
          "description": "On screen but covered by something else. The planner should clear the obstacle before acting on this element."
        },
        "covered_by": {
          "type": "string",
          "pattern": "^E[0-9]{1,6}$",
          "description": "EID of the element covering this one, when that element is itself in this payload."
        }
      },
      "allOf": [
        {
          "if": {
            "properties": {
              "input_type": {
                "const": "password"
              }
            },
            "required": [
              "input_type"
            ]
          },
          "then": {
            "not": {
              "required": [
                "value_len_bucket"
              ]
            }
          }
        }
      ]
    },
    "visualRegion": {
      "type": "object",
      "additionalProperties": false,
      "required": [
        "rid",
        "class",
        "bbox"
      ],
      "properties": {
        "rid": {
          "type": "string",
          "minLength": 1,
          "description": "Region id, unique within the capture."
        },
        "class": {
          "type": "string",
          "description": "Detector class, e.g. button, face, id_document, card, signature, qr, or unscanned_media (the Stage 2 fail-closed default for images/canvas/video/embeds/unmapped iframes, until Stage 6 vision can classify them)."
        },
        "bbox": {
          "$ref": "#/$defs/bbox"
        },
        "ocr": {
          "type": "string",
          "description": "OCR text for detector-only regions, already tokenized."
        }
      }
    },
    "redaction": {
      "type": "object",
      "additionalProperties": false,
      "required": [
        "rid",
        "kind",
        "type",
        "bbox"
      ],
      "properties": {
        "rid": {
          "type": "string",
          "minLength": 1
        },
        "kind": {
          "type": "string",
          "enum": [
            "FILL",
            "LABELLED_FILL",
            "BLUR",
            "FILL_REGION"
          ],
          "description": "FILL = solid fill over text PII. LABELLED_FILL = solid fill with the type/token drawn inside it. BLUR = irreversible blur, faces only. FILL_REGION = solid fill over a whole document/card region."
        },
        "type": {
          "type": "string",
          "description": "PII type that triggered the redaction, e.g. AADHAAR, FACE, PASSWORD."
        },
        "bbox": {
          "$ref": "#/$defs/bbox"
        },
        "reason": {
          "type": "string",
          "description": "Why the policy fired. Must not restate the redacted value."
        },
        "token": {
          "$ref": "#/$defs/piiToken",
          "description": "When the masked value was tokenized, the token the server can correlate this masked region with."
        },
        "eid": {
          "type": "string",
          "pattern": "^E[0-9]{1,6}$"
        }
      }
    },
    "dataUrlImage": {
      "type": "string",
      "pattern": "^data:image/(png|webp|jpeg);base64,[A-Za-z0-9+/]+={0,2}$"
    },
    "piiToken": {
      "type": "string",
      "pattern": "^\\[\\[PII:[A-Z_]+:[a-z2-7]{8}\\]\\]$",
      "description": "An HMAC token minted by the extension's vault. See AGENTS.md invariant 3."
    },
    "textBlock": {
      "type": "object",
      "additionalProperties": false,
      "required": [
        "tid",
        "role",
        "text",
        "bbox"
      ],
      "properties": {
        "tid": {
          "type": "string",
          "minLength": 1,
          "description": "Text block id, unique within the capture."
        },
        "role": {
          "type": "string",
          "description": "Accessibility role of the block element (paragraph, cell, heading...)."
        },
        "text": {
          "type": "string",
          "description": "Sanitized block text. May contain tokens; never raw PII."
        },
        "bbox": {
          "$ref": "#/$defs/bbox"
        }
      }
    },
    "historyEntry": {
      "title": "HistoryEntry",
      "type": "object",
      "additionalProperties": false,
      "required": [
        "step",
        "action",
        "verdict"
      ],
      "properties": {
        "step": {
          "type": "integer",
          "minimum": 0,
          "maximum": 100000
        },
        "action": {
          "enum": [
            "observe",
            "click",
            "type",
            "select",
            "check",
            "scroll",
            "hover",
            "key",
            "wait",
            "navigate",
            "ask_user",
            "done",
            "fail",
            "request_context"
          ]
        },
        "eid": {
          "type": "string",
          "pattern": "^E[0-9]{1,6}$"
        },
        "verdict": {
          "enum": [
            "PASS",
            "FAIL",
            "REJECT",
            "ABORT_BATCH",
            "DROP_REMAINING",
            "USER_REQUIRED",
            "STOPPED"
          ]
        },
        "code": {
          "enum": [
            "STALE_PLAN",
            "INVALID_SCHEMA",
            "PLAN_STEPS_REPEATED",
            "NEW_SCREEN",
            "TARGET_MISSING",
            "FP_MISMATCH",
            "AMBIGUOUS_TARGET",
            "NOT_VISIBLE",
            "NOT_HITTABLE",
            "DISABLED",
            "TOKEN_TYPE_MISMATCH",
            "TOKEN_IN_URL",
            "TOKEN_IN_KEY",
            "TOKEN_OUTSIDE_TYPE",
            "UNSUPPORTED_URL",
            "NEVER_AUTOMATED",
            "CONSENT_DENIED",
            "APPROVAL_SKIPPED",
            "EXEC_FAILED",
            "EXEC_UNTRUSTED_REJECTED",
            "VALUE_MISMATCH",
            "EXPECT_FAILED",
            "UNVERIFIABLE",
            "DONE_UNVERIFIED",
            "BUDGET_EXHAUSTED",
            "LOOP_DETECTED",
            "NO_PROGRESS",
            "CONTEXT_DENIED",
            "NETWORK_ERROR",
            "STOPPED",
            "USER_HINT",
            "USER_RETRY",
            "MODEL_FAILED"
          ]
        }
      }
    }
  }
}
