{"capture_id":"aee8e93f-bfa0-480b-af9c-8970e200271e","elements":[{"bbox":[50,145,53,19],"eid":"E1","enabled":true,"fp":"e8e74c12","has_value":false,"label":"← back","role":"link","value_len_bucket":"empty","visible":true},{"bbox":[0,0,0,0],"eid":"E2","enabled":false,"fp":"a9b56ca1","hidden_interactive":true,"label":"Full name","role":"textbox","visible":false},{"bbox":[0,0,0,0],"eid":"E3","enabled":false,"fp":"858e505f","hidden_interactive":true,"label":"Email address","role":"textbox","visible":false},{"bbox":[0,0,0,0],"eid":"E4","enabled":false,"fp":"953c1e68","hidden_interactive":true,"label":"Mobile","role":"textbox","visible":false},{"bbox":[0,0,0,0],"eid":"E5","enabled":false,"fp":"2d5ee99e","hidden_interactive":true,"label":"PIN code","role":"textbox","visible":false},{"bbox":[0,0,0,0],"eid":"E6","enabled":false,"fp":"93e9dcd0","hidden_interactive":true,"label":"Card number","role":"textbox","visible":false},{"bbox":[0,0,0,0],"eid":"E7","enabled":false,"fp":"285810e0","hidden_interactive":true,"label":"CVV","role":"textbox","visible":false},{"bbox":[0,0,0,0],"eid":"E8","enabled":false,"fp":"d52e75d2","hidden_interactive":true,"label":"One Time Password","role":"textbox","visible":false},{"bbox":[0,0,0,0],"eid":"E9","enabled":false,"fp":"92ed0b17","hidden_interactive":true,"label":"Password","role":"textbox","visible":false},{"bbox":[0,0,0,0],"eid":"E10","enabled":false,"fp":"03ad2301","hidden_interactive":true,"label":"API key","role":"textbox","visible":false},{"bbox":[0,0,0,0],"eid":"E11","enabled":false,"fp":"c06039d2","hidden_interactive":true,"label":"Mutate the text above","role":"button","visible":false},{"bbox":[551,3670,262,30],"eid":"E12","enabled":true,"fp":"6209a541","has_value":true,"input_type":"text","label":"Framed name","role":"textbox","value_len_bucket":"short","visible":true}],"field_hints":[],"image":"data:image/png;base64,iVBORw0KGgoAAAANSUhEUgAABQAAAALRCAYAAAAEIQ7zAAAQAElEQVR4AeydBZxVRRuH37O77C4pXRaoiN2d2N3d3YoodnyK3WIHBoiNhd2t2IUiFiAK0t2x+80zu3M5e/fe7V02/vyYe86ZnmfqnXfmnM3I1z8REAEREAEREAEREAEREAEREAEREIH6TkDlEwERaMAEMkz/REAEREAEREAEREAEREAEGggBFVMEREAEREAERKAhEpACsCHWusosAiIgAiLQsAmo9CIgAiIgAiIgAiIgAiIgAg2KgBSADaq6VVgRWEJAdyIgAiIgAiIgAiIgAiIgAiIgAiIgAvWfACWUAhAKMiIgAiIgAiIgAiIgAiIgAiIgAiJQfwmoZCIgAg2cgBSADbwBqPgiIAIiIAIiIAIiIAINhYDKKQIiIAIiIAIi0FAJSAHYUGte5RYBERABEWiYBFRqERABERABERABERABERCBBkdACsAGV+UqsAiYiYEIiIAIiIAIiIAIiIAIiIAIiIAIiED9JxBKKAVgIKGrCIiACIiACIiACIiACIiACIiACNQ/AiqRCIiACJgUgGoEIiACIiACIiACIiACIlDvCaiAIiACIiACIiACDZmAFIANufZVdhEQAREQgYZFQKUVAREQAREQAREQAREQARFokASkAGyQ1a5CN2QCKrsIiIAIiIAIiIAIiIAIiIAIiIAIiED9JxAvoRSAcRq6FwEREAEREAEREAEREAEREAEREIH6Q0AlEQEREAFPQApAj0E/IiACIiACIiACIiACIlBfCahcIiACIiACIiACDZ2AFIANvQWo/CIgAiIgAg2DgEopAiIgAiIgAiIgAiIgAiLQYAlIAdhgq14Fb4gEVGYREAEREAEREAEREAEREAEREAEREIH6TyC5hFIAJhPRswiIgAiIgAiIgAiIgAiIgAiIgAjUfQIqgQiIgAgkCEgBmEChGxEQAREQAREQAREQARGobwRUHhEQAREQAREQAREwkwJQrUAEREAEREAE6jsBlU8EREAEREAEREAEREAERKBBE5ACsEFXvwrfkAiorCIgAiIgAiIgAiIgAiIgAiIgAiIgAvWfQKoSSgGYiorsREAEREAEREAEREAEREAEREAERKDuElDORUAERKAIASkAi+DQgwiIgAiIgAiIgAiIgAjUFwIqhwiIgAiIgAiIgAgUEJACsICDfkVABERABESgfhJQqURABERABERABERABERABBo8ASkAG3wTEICGQEBlFAEREAEREAEREAEREAEREAEREAERqP8E0pVQCsB0ZGQvAiIgAiIgAiIgAiIgAiIgAiIgAnWPgHIsAiIgAsUIVK8CcPEss3l/m835XUYM1AbUBtQG1AbUBtQG1AbUBtQGaqwNSP7WGqSWt4F5/5jlzS22QJWFCIiACIhA9RCoPgXg7F/NxvY3m/C82cTBMmKgNqA2oDagNqA2UNNtQOmpzakNqA2oDagN1NY2MGGQWy8+YoYisHrWuopVBERABEQgRqB6FIDsbE59zyy7rdkym5i12UFGDNQGllIbUP/T+KM2oDagNqA2oDagNqA2oDZQ69pAi43MspYxm/SK2fx/YktU3YqACIiACFSUQEnhMkpyrJDboukFu2w5y5o1XdUss0mFolEgERABERABERABERABERABERCBekogq5lZszXMslqYTXhJrwNXXTUrJhEQARFISSAjpW1lLOeNMouyzHI6mP6JgAiIgAiIgAiIgAiIgAjUNAGlJwJ1iEDuCmb5C80WTKxDmVZWRUAERKDuEah6BSAnACMXbUZu3aOhHIuACIiACIhAfSGgcoiACIiACIhAXSDAScD8xWaL59SF3CqPIiACIlBnCThNXZ3NuzIuAiJQCgE5i4AIiIAIiIAIiIAIiIAIiIAIiIAI1H8CpZVQCsDSCMldBERABERABERABERABERABERABGo/AeVQBERABNISkAIwLRo5iIAIiIAIiIAIiIAIiEBdI6D8ioAIiIAIiIAIiEBxAlIAFmciGxEQgQZCIC8vzxYvXmT5+fk1UuL8/ML0XLpVkWCeyzv5r4q4yhvH1Mlj7d9Rv1he3uLyBk3pP9/Vwby5s1xd5KV0T2VJ2pSfsKncS7PLd/Xw3z+/2cRxo0rzWmvc8xxv6t2slDZba3Jc9Rmhvql3WFR97IpRBCpOIG/x4hqdUyqe09oTcv68OfbX8K9s7pwZtSdTykmJBBh7GYMb8jxUIiA5ioAIiEAtJlCrFIAI9f/9+4f99+/v3oxz99OnTXALwtQLnRnTJnp/wX/8On3qhAT2aZP/8/6mTR6XsEu+mThupPcza+bUZCeXfp799vNn9vbge+z1QbfZL9+95+xS56lY4Cq2mD51vH3xwTP2xnO328jfvzWEzXgSMBs35k9buGBe3NrfT574jy/j7FnT/HPgx6LbW8R+8APPwDG5bnBLNtOnFvBd7JQS/7m6mzRulONUdDFPPBPGjjDM4kULfYrY4f+/wnpPvoYyTvivoI6S3cMz7kSIYDJ+7F/GM3nBLm6mThprn7wz0NXlrfb7L595YT3unuo+OY/jXF6nu7rAPpX/uN0El5eh375rM6dPilvbjBLaL2UaN+YPW7hwfpEwEx2D33/53CaN/7uIfaqHkuwITxqpzNy5M0sKWq/cXhh4lV3be3v7/L0naqRc7758v0/v+QFXVEl615y3vY+Pvm01+I8x48kHLrB+t5xYJcqzj98eYNecu53ddPFu9sOXb5S5JPded6QvP/24zIFiHhknHrnjdOt/55kWxqOYc627ZTy765pD7ZbL9vbjW3kyyOKa/p48DhHH/PlzbJwbs6dMGsNjrTc/ffOWr/en+11U6/OqDDYsAjdctItvmyN//6ZhFbwSpf3io2et/11n2fuv9atELApaUwSYKx+7+2zfzv8d+UtNJat0REAEREAEykCgLF5qlQJwwfy5drdb3Nx9zWHuepix0Lnpot2sT88t7bF7zrbRf/1YpEzvOIVc8Jt8feuFOxJ+Xxh4tY/vwVtPcAqp4oq7MX8Ps75XHuj9fPXxc4lwKHeG/fCB3dHnYHvs7p720RuP2GdOUfDkgxfY9RfsbF9/+kLCb3XfzJ09w568/3y3QN7dXnnmJvv03cftodtOtpsv3cN+/fEjnzz5fcEpNO66+hAnSD3o7cLP6BE/2R2ujPded4Rb6P3urQO/e5zdDKdo9ZaFP19++Kzn8cZzt3kbFIp3x+rm7sI6il8HPXq594ui9W7nd+B95xqKAm9Z+LN48UK778ajjboIi82FC+a7tA515rCUZvq08T70g7ccn9L97sK8UG48znW7yPffeIw9fPspTsk2AStvZs6YbM8+cpndfuX+9ubzfV1dPmkD7urp29dHb/ZP2TZ8QPez0ClU73Zlujuk5a43Xby7XXnWFk5wPdMpY1ML+/+6tnXHVQfb0/0utBddO3RRJf4H/iHO5OtdVx/m6uqPhP+pTpHdt8+BLs9n+bpPrrOExzLcPNz3tLQsf/zy9TLEUD+8LHJjzvx5s4spWqurdIucQpf0GOuqIo35c2cb8eXnFR/XqiL+dHFEUYZl5zS2rOwci6Ionbcy2f/565f29ot3ubFipnVZZQNr1bZzmcLhibJjFi9axGO5TVajRpaZmeXL4gpS7vClBfjwjYcNZe+oP74vzWsZ3fNdfc9xZrZxerWMgby3od+84/s84z0bAN6y8GfE8K/t7msPtzCGF1rX2kue2zyi3he4cbnWZlIZq3YC48f+6frXlfap29BD/qn2BMuQwPx5s3z/XLy4ak5GlyHJWuulrONfdnZjy89bbFxrbWHqcMb+GDbE9ZMrDJmzqoqxYMFc387zXL1VVZyKp8oIKCIREAERKJFARomuS8kxwy3Iuq2xuXVfa0tr1ry1Idj9NvRTe+yeXpZq4dy0WStbc/3ti5gVV1mvWO6nTxlnw75/r6h9fr699eLdRe0KnyaNH+WVNhPHjbSc3Ca23qZ72FY7HmnNWrS22TOn2EuPX2u//vRxoe/qvbzx/O32yw/vW6PsXNthz1Ps0JNusM7Lr+YUXBPt8UJFWxRFtsX2h/qMfPzWAOP0JA8oHZ584HxbvHiRde22ga282iZYJ8yUif/aG04hBueEZdJNZlaWrbXBDgnGUVSw6O+4bLeEXfe1t0kKVf7HlVfbOBFfqNOc3KY+orU22DHh1rhJc2+3TKsOCbv1Xf14yzQ/77/6gP341Ru+PXVcrpvtvO+Ztspqm1pefp69/dJd9sWHT6cJucQ6iiJbZfVNbbV1trbmLdqYOQx//DLE1UFvm+OUtJb0j4VJsPpr+Je+DsJzF1cXoYwrrLSOs44sIyMzUZ61N9zRmjZraeHfn06IC/ezZkwxTnqG54pe23fsmkgv5KV955V9dLQHjH+I/WCHiVl5prSvPNfG4vbhHv8YnvMd77zCxVG+638Y7OMGO0zcLn6PGyZuZ5bv85Fsz/Nip3jOd+kW9Z/6KT9FnlLZhdB5riyUHT/BrqzXvLw8K1mAzrc8x7S88ZOXdOFww8TzyDOmNLvgnuPGwxPPfdAuveU9a99ppWCduJLfkstV4JU0h/3woa+3FVdez446o691WWX9AsfC33zHiPjwW2iV9pLnFiMwTfZAWIy3d/Ub4mvboYtdcP0b1vN/z1imm3e8e+wn36UNx5hVsds80nR1lOxAesN/+sS+G/KqMYfwnMrPYtc2iSPZLTwTLuQ32FXmygnAx+4+282lc8oWjeOV58pX5jw4/+SZ/kgClK3gmacCg52Pz/EtsCn+Sxj8pKrP4r5T2eT7duV+vCNpYvxDmp+Sykl+MATlil/ul5h8P76XmF/HhjJhQr6WhHfEnDtxY8cVf1x5rrBxcRJPaWXPd+Nj8TIlpVoYV767JrkkHvNdnS4uoU0TFpMI4G54xrhb/597jH9wP3mu/eW5fuZuE/9x5xT+d0NeMRQc+S5dRzDhnu4mz8Wz2OUv3/tP9pWqzeQleyryTD7yXP64FnFI8ZDn017kxvyS48RfnptXikdRNH/BnbQxS54L/RVaUP/5sfLi19uVUI95hXnNd+2iMJrEJd+FwxRYFLT7/CR/+c5PaeNfQXizzbc72K6650vbae/TglXimu/iLS2vwXO+SxMTnvNS1EtBuRa67le8DgiLKQif7+fe/Bi3AnvXylKkE9zCNa8EfsFPfhnKVhBPWfJrPr/J40++y+u4f37389DQb99x5S6+WYgfGJNWyFvyFT8FPItzS/arZxEQAREQgdpNIKM2Zi8np7Htf/QVdvSZd9oFN7xhR55+m98Z5GRX/7vOKpblVdbYzA4/5eYiZtNtDyrmD4s3nr/DOL7OPYZTVePGFJyI4zluPnn7MafUmW5t2q9gZ1/xnB103FW224HnuMXis7Zcl7W81w9ff8gtpOb6++r64fQZryAT/16HXGDb73myrb3hTnbKBY96pdzyXdfyr/bivvaGO1vXVTfi1gY7BSVl/fWnj5zCcqq1dAeVHAAAEABJREFUaNneDnOcvGPSz7DvP7CfnXCQZJ14zMxsZIedfFOCcU5uM++25Y5HJOy23ukob1eZn30OvzQRX6jTJk2X8VHue8QStxVWWtfbrbFuj4T//Y+5wtul+kFhy0IhiiLb0SlQz7rsadt21+NcG7vDtt3lOB/k3ZcfKLUuMzKybL8jL7ejTu/rFAev27Fn3W2Nm7YwTjr2v+sMH0/4mT1rqnG6NMcpMFdwCr5FixYabSq4b7jF3om877jXaRZlRE653CZhd6hT8rZut1zw7r+RE0WRLbvC6k6Iy/PKzIRjBW822+6QRHqB90qrFrQfTiw+8/AlNjym5KY9DXrkMnvx8att5vSJPtVpU/6zwU9c608mDrjnbHv56Rtt1ozJ3o2fSeP/tuf6/8/eeO52v1B7ut/F/qTR3DkzfTjSQAmEXwzfAyL+5x+70ljgYRc3I37/xgjz/IAr49b2seuv2H/4+sPenrx+/v5T9sxDF9ujd5xhpPvRm48agq73kOJn3Jg/jDhefeamhCv976UnrvH2C+cv6evYv/3S3fbYvb1c2c+0Zx+51PieXCJgCTfk4cuPBtmTD5xnA+89x+/M5yctNGizLz91ow1wyprH7u5prziuc8vwevbsmVPtladu8OEG3NXT11U4bYsQ//Fb/X1Zxo4ensjhS48XlC/YzXYbHHDALHaL5YTHwpuFC+e7jZO7fD2iUCq09qe0Bz36PyO/T9x/nn/Nfu6cGcG52PXVZ262337+xNtzQpf0qAMs2Ox575UH7Kl+F1r/O8/wfH/48nXX9osvYMjv4Cevt4H3nGNPuc2OH79+kyi8oR285NoncU9xmx3cD3R1xqv5bArR1shHnluw+QDuZ8a0ia5O7rUnH7zA2Hh6fkAf15d/dS5L/k+eMNqzHejqz/t5rE8RpfyzD19i+CEEp8VJH/48Y/789QsLbfPx+3rb+68+aIsWLcApYf7+60cjHnhyunvyhH8SbiXelOI4ZfIY+/TdJ0rxZX6Dif5MGxzg5t5Bj15eahv/9N3HjbJ+9cmL9uYLd/g6oawkRvm//Wywa/fn+z75lKvbX5I25fDDhh9pkSZ9hPqZ68YL4iir+embd3w+Pv/gafvknYFGe6Su3ncbQaQRj2eGq2/aTyjn4Cevs2mT/4t7sefdeDPo0cvcuPumb4vU+aKFBfXF657PPXqFUU9Puvb37iv3W3ALkXBa7bn+V7ix4izv70XXJqdMLFqfuL/w2FX+VP9zrh9Rfk6QTnZtLcRTnuvIP76zQW7sJR7KT7lmTp9cJApOrJHfpx68yCgT6Y8dXbStE+Dbz17y/Z0ywuGnb97Guoj56eu3fJ/pf8eZ9sR9ve2jNx/xSongafzYv3ydsKEZ7LgOcu2KNjPDzSnUDRtnPI8eMdRtzt3txzLiG/LBM4n4GMc4uU94xoxn3Pg77IePeExpFjtlEGF4k+LRvmf4fH7z6UtOGbfkpN4vTg4i3a9dWT92m6iP33uuLwN5ShXp1Elj3CbxVZ4bfXnEb1+n8ubtvvrked8G+7u5iDby9SfF3yCZ7NrDWy/caU+6sXOgG6NecuMynzLxEbifn75+2/P7xPUx9+j/z3L1SZ4xlJG8LuH3k73hNncHuL77lOtrY/7+1X86AN4D7jzLz8t8VsRHVPjDePnhGw/7ean/nWe6Ov+fjf1nyVzBuExaGOJ74bGrXZvuaU8/dLEf/wuj8eNWaLepxr/gj+twt1HyrJMrfvjqdR69YX79wMnXTz14oRv/XT6c+7AfPnBu+c6k/v/x2wNcupd6mQX5BXkkjD2hXIy1QR74/efPikQEq+dcf+F7hC89cZ2vV7gNj8lABCBuyo89dfTYPWfbvMLxKaQz8N5zCvLt+nGcH+Hx84lrX0/1u8j7QXb42cvfS8rG+PGJKw/tnvySHvkifDAfvN7Pt4ehri8OdmMW/fdJJ1P89M1bwYsNceNf4Dpj2iTvP35w4Z9RP9tzLo+0S/L8zuB7/cm+RATuZs7s6fZyoUzxtMvzMOrBKRadk/6LgAiIgAjUQQK1UgEY55iZmWWcBtxx79O99b9uspqR9LoqAg+Lt7jBzgeI/eQ2bu4VCryWGaz/GTXUK8fCibJgjyDFyQ2eUdRw0ox7TNNmrezAY680TmtNcsqNObOmYV1tJjOrkWU6DiTw9Wcv+u+/LZg/x7BHKXfqhQOMk324Y3fQcX0MpROKkr/dAvL9V/t5IXejrfa1xk1a4K2IadKspVeKIMCxKC7iWJkHJyAgxKAsCIZnWyLjFIs9XocF93nF/FTE4hu36CTtTKfI3LTHwYko4LXj3qcaCuO1N9zRK3wTjqXccFK166obul3rAsXfmFHDbGps0Thp/GibNmWcdVh2Fdtl/7N9bAjW5MM/lOOHU5y//fypb3M773eWCxn5hei8ebPdffH/ZbVht7iA82LfRrgPYTMbNbKhTrD8/ovXEkqX34Z+aihX/v7zB6M/oQTkO3DffPaSsbhDgfTlh8/aYKeM4RUR4qJ//Pzde/6VeRYUw4d+4hcUKJZQqJLGz9+9m0hj8sTR9q2rr9F//WSceCWOuGnZupNTVr9r33/xq